Type,Text
istj,introverted observant thinking judging traits tend reserved willful rational outlook life compose actions carefully carry methodical purpose observation person found adequate discharge duty worse executed persons scarcely employed thought abundant making   population defining characteristics integrity practical logic tireless dedication duty vital core families organizations uphold traditions rules standards law offices regulatory bodies military enjoy taking responsibility actions pride work working goal hold time energy completing relevant task accuracy patience assumptions preferring instead analyze surroundings check facts arrive practical courses action nonsense decision relay facts necessary achieve goal expecting grasp situation immediately action little tolerance indecisiveness lose patience quickly chosen course challenged impractical theories especially ignore key details challenges time consuming debates noticeably angry deadlines tick nearer going meeting obligations matter personal cost baffled hold word respect combining laziness dishonesty quickest way bad consequently prefer work authority clearly established hierarchy set achieve goals debate worry reliability sharp fact based minds prefer autonomy sufficiency reliance dependency seen weakness passion duty dependability impeccable personal integrity forbid falling trap sense personal integrity core goes minds adhere established rules guidelines regardless cost reporting mistakes telling truth consequences disastrous honesty far important emotional considerations blunt approach leaves false impression cold robotic struggle express emotion affection outwardly suggestion feel worse deeply hurtful dedication excellent quality allowing accomplish core weakness scrupulous individuals advantage seek stability security considering duty maintain smooth operation find coworkers significant shift responsibilities knowing slack tend opinions let facts talking long time observable evidence tells story remember care stubborn dedication stability efficiency compromise goals long term lean harder creating emotional strain unexpressed years finally coming late fix find coworkers spouses genuinely appreciate complement qualities enjoy brightness clarity dependability offer find stabilizing role tremendously satisfying knowing system works member create free profile taking test entering results member create free profile taking test entering results practical dedicated known reliability hard work good creating maintaining secure stable environment loved ones dedication invaluable areas including personal growth easily tripped areas practical methodical approach liability asset finding keeping partner learning relax improvise reaching dazzling heights career ladder managing workload conscious effort develop weaker traits additional skills read far introduction complex concept muttered wow accurate little creepy finally understands asked know closest trick felt understood studied think reach potential spy challenges faced face future overcome simply learn succeeded order plan personal roadmap best car world right place know want told tend behave certain circumstances key strengths weaknesses deeper answer knowledge beginning lifelong journey ready learn act way motivates inspires afraid secretly dream unlock true exceptional potential premium profiles provide roadmap happier successful versatile willing able challenge obvious imagine follow path instead going flow want reins hands help member create free profile taking test entering results
isfj,introverted observant feeling judging traits tend warm unassuming steady way efficient responsible giving careful attention practical details daily lives love grows sharing giving away unique qualities defy definition individual traits sensitive excellent analytical abilities reserved developed skills robust social relationships generally conservative receptive change new ideas things sum parts way use strengths defines hardly better large proportion population nearly   combining best tradition desire good found lines work sense history medicine academics charitable social work especially turbulent ones meticulous point perfectionism procrastinate relied job time responsibilities personally consistently going exceed expectations delight work home challenge ensuring noticed tendency underplay accomplishments kindness respected cynical selfish likely advantage dedication humbleness pushing work taking credit know stand maintain confidence enthusiasm naturally social odd quality introverts utilize excellent memories retain data trivia remember details lives comes gift giving equal imagination natural sensitivity express generosity ways touch hearts recipients certainly true coworkers consider personal friends family expressions affection fully bloom wonderful group rarely sitting idle worthy cause remains unfinished ability connect intimate level unrivaled introverts joy experience connections maintain supportive happy family gift involved truly comfortable spotlight feel guilty taking credit team efforts ensure efforts recognized likely feel level satisfaction dream member create free profile taking test entering results member create free profile taking test entering results practical dedicated known reliability altruism good creating maintaining secure stable environment loved ones dedication invaluable areas including personal growth easily tripped areas kindness practical approach liability asset finding keeping partner learning relax improvise reaching dazzling heights career ladder managing workload conscious effort develop weaker traits additional skills read far introduction complex concept muttered wow accurate little creepy finally understands asked know closest trick felt understood studied think reach potential spy challenges faced face future overcome simply learn succeeded order plan personal roadmap best car world right place know want told tend behave certain circumstances key strengths weaknesses deeper answer knowledge beginning lifelong journey ready learn act way motivates inspires afraid secretly dream unlock true exceptional potential premium profiles provide roadmap happier successful versatile willing able challenge obvious imagine follow path instead going flow want reins hands help member create free profile taking test entering results
estj,extraverted observant thinking judging traits possess great fortitude emphatically following sensible judgment serve stabilizing force able offer solid direction amid adversity good order foundation things representatives tradition order utilizing understanding right wrong socially acceptable bring families communities embracing values honesty dedication dignity valued clear advice guidance happily lead way difficult paths taking pride bringing roles community organizers working hard bring celebration cherished local events defense traditional values hold families communities demand leadership high democratic societies forming   population wonder america presidents strong believers rule law authority earned lead example demonstrating dedication purposeful honesty utter rejection laziness cheating especially work declares hard manual work excellent way build character aware surroundings live world clear verifiable facts surety knowledge means heavy resistance stick principles push unclouded vision acceptable opinions talk willing dive challenging projects improving action plans sorting details way making complicated tasks easy approachable work expect reliability work ethic reciprocated meet promises partners subordinates jeopardize incompetence laziness worse dishonesty hesitate wrath earn reputation inflexibility trait shared sentinel arbitrarily stubborn truly believe values society work main challenge recognize follows path contributes way true leader recognizes strength individual group helps bring individuals ideas table way facts able lead charge directions work member create free profile taking test entering results member create free profile taking test entering results practical strong willed known reliability administrative skills good creating maintaining secure stable environment loved ones dedication invaluable areas including personal growth easily tripped areas rational practical approach liability asset finding keeping partner learning relax improvise reaching dazzling heights career ladder managing workload conscious effort develop weaker traits additional skills read far introduction complex concept muttered wow accurate little creepy finally understands asked know closest trick felt understood studied think reach potential spy challenges faced face future overcome simply learn succeeded order plan personal roadmap best car world right place know want told tend behave certain circumstances key strengths weaknesses deeper answer knowledge beginning lifelong journey ready learn act way motivates inspires afraid secretly dream unlock true exceptional potential premium profiles provide roadmap happier successful versatile willing able challenge obvious imagine follow path instead going flow want reins hands help member create free profile taking test entering results
esfj,person extraverted observant feeling judging traits attentive focused enjoy taking social community achievements guided decisive values willingly offer guidance encourage lift strengthen positive energy spread felt share lack better word popular makes sense given common making percent population high school cheerleaders quarterbacks setting tone taking spotlight leading teams forward victory fame later life continue enjoy supporting friends loved ones organizing social gatherings best sure happy discussing scientific theories debating european politics likely capture interest long concerned fashion appearance social status standings practical matters gossip bread butter best use powers good altruists seriously responsibility help right thing unlike diplomat relatives base moral compass established traditions laws upholding authority rules drawing morality philosophy mysticism important remember come backgrounds perspectives right absolute truth love service enjoying role allows participate meaningful way long know valued appreciated especially apparent home loyal devoted partners parents respect hierarchy best position authority home work allows things clear stable organized supportive outgoing spotted party ones finding time chat laugh devotion goes breezing truly enjoy hearing friends relationships activities remembering little details standing ready talk things warmth sensitivity things going right tension room pick try restore harmony stability group pretty conflict averse spend lot energy establishing social order prefer plans organized events open ended activities spontaneous togethers lot effort activities arranged easy feelings hurt ideas rejected interested important remember coming different place disinterest comment activity organized thing coming terms sensitivity biggest challenge going disagree going criticize hurts life best thing best role model care power care enjoy appreciate efforts member create free profile taking test entering results member create free profile taking test entering results practical caring known social administrative skills good creating maintaining secure stable friendly environment loved ones dedication invaluable areas including personal growth easily tripped areas kindness practical approach liability asset finding keeping partner learning relax improvise reaching dazzling heights career ladder managing workload conscious effort develop weaker traits additional skills read far introduction complex concept muttered wow accurate little creepy finally understands asked know closest trick felt understood studied think reach potential spy challenges faced face future overcome simply learn succeeded order plan personal roadmap best car world right place know want told tend behave certain circumstances key strengths weaknesses deeper answer knowledge beginning lifelong journey ready learn act way motivates inspires afraid secretly dream unlock true exceptional potential premium profiles provide roadmap happier successful versatile willing able challenge obvious imagine follow path instead going flow want reins hands help member create free profile taking test entering results
istp,introverted observant thinking prospecting traits tend individualistic mindset pursuing goals needing external connection engage life inquisitiveness personal skill varying approach needed wanted live life different life want place day job wanted interesting challenges love explore hands eyes touching examining world cool rationalism spirited curiosity natural makers moving project project building useful superfluous fun learning environment mechanics engineers find greater joy getting hands dirty pulling things apart putting little bit better explore ideas creating troubleshooting trial error hand experience enjoy having interest projects mind getting space course condition interfere principles freedom open returning interest kind enjoy lending hand sharing experience especially care shame uncommon making percent population women especially rare typical gender roles society tends expect poor fit seen tomboys young age mechanical tendencies appear simple glance actually enigmatic friendly private calm suddenly spontaneous extremely curious unable stay focused formal studies challenge predict friends loved ones loyal steady tend build store impulsive energy explodes warning taking interests bold new directions decisions stem sense practical realism heart strong sense direct fairness unto attitude helps explain puzzling traits instead overly cautious avoiding stepping toes order avoid having toes stepped likely far accepting likewise retaliation good bad fair play biggest issue likely face act soon taking granted permissive nature assuming tell insensitive joke overly involved project roughhouse play suddenly change plans interesting came come learn firmly drawn lines rules acceptable behavior want hear insensitive joke certainly tell want engage horseplay willing party situation emotionally charged violating boundaries backfire tremendously particular difficulty predicting emotions natural extension fairness given difficult gauge emotions motivations tendency explore relationships actions empathy lead frustrating situations struggle boundaries guidelines preferring freedom color outside lines finding environment work good friends understand style unpredictability combining creativity sense humor hands approach build practical solutions things happy years building useful boxes admiring outside member create free profile taking test entering results member create free profile taking test entering results bold practical known technical mastery willingness improvise good finding unique solutions seemingly impossible challenges desire explore learn new things invaluable areas including personal growth easily tripped areas focus practical matters liability asset finding keeping partner reaching dazzling heights career ladder learning plan ahead conscious effort develop weaker traits additional skills read far introduction complex concept muttered wow accurate little creepy finally understands asked know closest trick felt understood studied think reach potential spy challenges faced face future overcome simply learn succeeded order plan personal roadmap best car world right place know want told tend behave certain circumstances key strengths weaknesses deeper answer knowledge beginning lifelong journey ready learn act way motivates inspires afraid secretly dream unlock true exceptional potential premium profiles provide roadmap happier successful versatile willing able challenge obvious imagine follow path instead going flow want reins hands help member create free profile taking test entering results
isfp,person introverted observant feeling prospecting traits tend open minds approaching life new experiences grounded warmth ability stay moment helps uncover exciting potentials change course day wake person sleep know certain somebody true artists necessarily typical sense painting happy little trees perfectly capable use aesthetics design choices actions push limits social convention enjoy upsetting traditional expectations experiments beauty behavior chances expressed phrase box live colorful sensual world inspired connections ideas joy reinterpreting connections reinventing experimenting new perspectives explores experiments way creates sense spontaneity making unpredictable close friends loved ones despite definitely introverts surprising friends step spotlight recharge mean sit idle time introspection assessing principles dwelling past future think return cloister transformed live find ways push passions riskier behaviors like gambling extreme sports common fortunately attunement moment environment allows better enjoy connecting certain irresistible charm criticism end poorly handle kindly phrased commentary valuing perspective help push passions new directions comments biting mature lose tempers spectacular fashion sensitive feelings value harmony faced criticism challenge step away moment long caught heat moment living moment goes ways heightened emotions argument cool usually past past occurred biggest challenge facing planning future finding constructive ideals base goals working goals create positive principles small task plan futures terms assets retirement plan actions behaviors contributions sense identity building portfolio experiences stocks goals principles noble act amazing charity selflessness happen establish centered identity acting selfishness manipulation egoism important remember actively person want developing maintaining new habit come naturally taking time day understand motivations allows use strengths pursue come love member create free profile taking test entering results member create free profile taking test entering results colorful charming known kindness artistic skills great finding exciting new things explore experience creativity earth attitude invaluable areas including personal growth easily tripped areas focus practical matters liability asset finding keeping partner reaching dazzling heights career ladder learning plan ahead conscious effort develop weaker traits additional skills read far introduction complex concept muttered wow accurate little creepy finally understands asked know closest trick felt understood studied think reach potential spy challenges faced face future overcome simply learn succeeded order plan personal roadmap best car world right place know want told tend behave certain circumstances key strengths weaknesses deeper answer knowledge beginning lifelong journey ready learn act way motivates inspires afraid secretly dream unlock true exceptional potential premium profiles provide roadmap happier successful versatile willing able challenge obvious imagine follow path instead going flow want reins hands help member create free profile taking test entering results
estp,extraverted observant thinking prospecting traits tend energetic action oriented deftly navigating love uncovering life opportunities socializing personal pursuits life daring adventure impact immediate surroundings best way spot party look whirling eddy flitting group group laughing entertaining blunt earthy humor love center attention audience member asked come stage volunteer volunteer shy friend theory abstract concepts plodding discussions global issues implications interested long conversation energetic good dose intelligence like talk better leap look fixing mistakes sitting idle preparing contingencies escape clauses likeliest lifestyle risky behavior live moment dive action eye storm enjoy drama passion pleasure emotional thrills stimulating logical minds forced critical decisions based factual immediate reality process rapid fire rational stimulus response makes school highly organized environments challenge certainly smart regimented lecturing approach formal education far hands learning enjoy takes great deal maturity process necessary means end creates exciting opportunities challenging makes sense use moral compass rules broken sentiment high school instructors corporate supervisors likely share earn certain reputation minimize trouble making harness energy focus boring stuff force reckoned perceptive unfiltered view unique skill noticing small changes shift facial expression new clothing style broken habit pick hidden thoughts motives lucky pick specific use observations immediately calling change asking questions little regard sensitivity remember wants secrets decisions broadcast careful caught moment things far run roughshod sensitive forget care health safety making percent population things spicy competitive cause systemic risk passion energy complemented rational distracted mind inspiring convincing colorful natural group leaders pulling path traveled bringing life excitement putting qualities constructive rewarding end true challenge member create free profile taking test entering results member create free profile taking test entering results charming attractive known ability improvise focus completely present great finding exciting new things explore experience creativity earth attitude invaluable areas including personal growth easily tripped situations focus practical matters liability asset finding keeping partner reaching dazzling heights career ladder learning plan ahead conscious effort develop weaker traits additional skills read far introduction complex concept muttered wow accurate little creepy finally understands asked know closest trick felt understood studied think reach potential spy challenges faced face future overcome simply learn succeeded order plan personal roadmap best car world right place know want told tend behave certain circumstances key strengths weaknesses deeper answer knowledge beginning lifelong journey ready learn act way motivates inspires afraid secretly dream unlock true exceptional potential premium profiles provide roadmap happier successful versatile willing able challenge obvious imagine follow path instead going flow want reins hands help member create free profile taking test entering results
esfp,person extraverted observant feeling prospecting traits love vibrant experiences engaging life eagerly taking pleasure discovering unknown social encouraging shared activities selfish impatient little insecure mistakes control times hard handle handle worst surely deserve best found spontaneously breaking song dance caught excitement moment want feel way generous time energy comes encouraging irresistible style love spotlight world stage famous actors love putting friends chatting unique earthy wit soaking attention making outing feel bit like party utterly social enjoy simplest things greater joy having fun good group friends talk strongest aesthetic sense grooming outfits appointed home eye fashion knowing attractive moment afraid change surroundings reflect personal style naturally curious exploring new designs styles ease like know observant sensitive emotions help talk challenging problem happily providing emotional support practical advice problem likely avoid conflict altogether address head usually love little drama passion focus criticisms bring biggest challenge face focused immediate pleasures neglect duties responsibilities luxuries possible complex analysis repetitive tasks matching statistics real consequences easy activities rely luck opportunity simply ask help extensive circle friends important challenge track long term things like retirement plans sugar intake wo help eye things recognize value quality fine trait combination tendency poor planners cause live means credit cards especially dangerous focused leaping opportunities planning long term goals find inattentiveness activities unaffordable welcome laughter playfulness volunteer try new fun greater joy bring ride chat hours topic meant talk share loved ones emotions good times bad remember ducks row ready dive new exciting things world offer friends tow member create free profile taking test entering results member create free profile taking test entering results charming attractive known ability improvise focus completely present great finding exciting new things explore experience energy enthusiasm earth attitude invaluable areas including personal growth easily tripped situations focus practical matters liability asset finding keeping partner reaching dazzling heights career ladder learning plan ahead conscious effort develop weaker traits additional skills read far introduction complex concept muttered wow accurate little creepy finally understands asked know closest trick felt understood studied think reach potential spy challenges faced face future overcome simply learn succeeded order plan personal roadmap best car world right place know want told tend behave certain circumstances key strengths weaknesses deeper answer knowledge beginning lifelong journey ready learn act way motivates inspires afraid secretly dream unlock true exceptional potential premium profiles provide roadmap happier successful versatile willing able challenge obvious imagine follow path instead going flow want reins hands help member create free profile taking test entering results
