Type,Text
intj,person introverted intuitive thinking judging traits thoughtful tacticians love perfecting details life applying creativity rationality inner world private complex thought constitutes greatness man man reed feeblest thing nature thinking reed lonely rarest capable intjs know rational quick witted struggle find nonstop analysis boldest dreamers bitterest pessimists believe willpower intelligence achieve challenging goals cynical human nature generally assuming lazy unimaginative simply doomed mediocrity derive esteem knowledge mental acuity school called bookworms nerds taking labels insults embrace confident ability teach master topic interests coding capoeira classical music entitled opinion entitled informed opinion entitled ignorant single minded little patience frivolity distractions idle gossip said mistake stereotype dull humorless known irreverent wit beneath exteriors sharp delightfully sarcastic sense humor question trust status quo relying conventional wisdom expertise lives skeptical prefer discoveries quest find better ways things afraid break rules risk disapproval fact enjoy tell new idea worth actually works want successful inventive bring single minded drive passion projects applying force insight logic willpower heaven help tries slow enforcing pointless rules offering poorly thought criticism comes strong independent streak mind acting like waiting catch generally feel comfortable making decisions asking input times lone wolf behavior come insensitive fails consideration thoughts desires plans known warm fuzzy tend prioritize rationality success politeness pleasantries words right popular explain fictional villains modeled value truth depth common social practices small talk white lies pointless downright stupid result inadvertently come rude offensive trying honest times wonder dealing worth frustration like crave social interaction prefer surround share values priorities achieve pursue interests natural confidence draw professionally socially romantically contradictions imaginative decisive ambitious private curious focused outside contradictions baffling perfect sense understand inner workings mind life like giant game chess relying strategy chance contemplate strengths weaknesses lose faith ingenuity insight find way win matter challenges arise way member create free profile taking test entering results member create free profile taking test entering results escape patterns systems exits resides outside system way armed powerful intellects strategic minds intjs outmaneuver obstacles unbeatable strengths misunderstood turn weaknesses reaching potential misunderstandings end read far introduction great deal tell reading profile probably hit tipping point went trademark skepticism huh wait little uncomfortable understood closest chances accepted maybe grown proud embracing disconnect requirement misused defense mechanism leading lonely inefficient path gaining insight rewarding effective spent years studying life stories experiences patterns hundreds surveys step step insight insight discovered challenges face challenges overcome specialized research based offerings use strengths avoid common pitfalls staying true point grow potential ways sense ready step read member create free profile taking test entering results
intp,introverted intuitive thinking prospecting traits flexible thinkers enjoy taking unconventional approach aspects life seek unlikely paths mixing willingness experiment personal creativity important thing stop questioning curiosity reason existence pride unique perspectives vigorous intellect help puzzle mysteries universe explain influential philosophers scientists time fairly rare creativity inventiveness afraid stand crowd lose thought necessarily bad thing hardly stop thinking moment wake minds buzz ideas questions insights times find conducting fledged debates heads outside live ending daydream reputation pensive detached bit reserved try train mental energy moment person hand bit uncomfortable regardless mode introverts tend tired extensive socializing long day crave time consult thoughts mistake think unfriendly uptight connect match mental energy absolutely light leaping thought things energize like opportunity swap ideas enjoy lively debate curious inquiring soul love analyze patterns necessarily knowing sherlock holmes like knack spotting discrepancies irregularities words bad idea lie ironically held word rarely mean dishonest active minds overflow ideas theories thought way change mind weekend plans fundamental moral principle realizing appeared mind place addition happy play devil order interesting discussion humming spend day musing ideas possibilities said practical everyday work turning ideas reality hold interest fortunately comes dissecting tricky multilayered problem coming creative solution match creative genius potential want understand universe area particular tends mystify human nature suggests feel home realm logic rationality result find baffled illogical irrational ways feelings emotions influence behavior including mean unfeeling generally want offer emotional support friends loved ones necessarily know decide best efficient way offer support hold saying analysis paralysis affect multiple areas lives overthink smallest decisions makes feel ineffective stuck exhausted endless parade thoughts mind struggle things good news stay stuck long unique strengths include pull ruts occasionally fall leveraging creativity open mindedness reach potential thinkers happy rounded member create free profile taking test entering results member create free profile taking test entering results armed powerful intellect vivid imagination overcome outmaneuver obstacles unbeatable time quirks unconstrained rationalism lead misunderstandings misunderstandings end read far introduction great deal tell point reading results probably hit tipping point went trademark skepticism huh wait little uncomfortable understood closest chances accepted maybe grown proud embracing disconnection requirement misused defense mechanism leading lonely inefficient path gaining insight rewarding date birth gimmick spy spent years studying life stories experiences patterns hundreds surveys step step insight insight discovered share qualities outlook overcome challenges faced unique individual wise learn experiences like share insights forward premium profile specialized assessments offer deeper mind answer act way find motivation inspiration moved fear pursue secretly want achieve life use strengths unlock exceptional potential avoid common pitfalls staying true point grow person know capable ways finally feel right read member create free profile taking test entering results
entj,extraverted intuitive thinking judging traits decisive love momentum accomplishment gather information construct creative visions rarely hesitate long acting time limited waste living life trapped dogma living results thinking let noise opinions drown inner voice important courage follow heart intuition know truly want secondary natural born leaders embody gifts charisma confidence project authority way draws crowds common goal characterized ruthless level rationality drive determination sharp minds achieve end set best percent population lest overwhelm timid sensitive rest world thank businesses institutions granted day love good challenge big small firmly believe given time resources achieve goal quality makes brilliant ability think strategically hold long term focus executing step plans determination precision makes powerful business leaders determination fulfilling prophecy push goals sheer willpower extraverted e nature means likely push right achieving spectacular results process negotiating table corporate environment buying car dominant relentless unforgiving coldhearted vicious se genuinely enjoy challenge battle wits repartee comes environment reason fold core tenet ultimate victory respect able stand intellectually able act precision quality equal particular skill recognizing talents helps team building efforts matter brilliant displaying arrogance condescension particular skill calling failures chilling degree insensitivity start run trouble emotional expression strong suit analyst distance emotions especially public felt directly broader swath especially professional environment simply crush sensitivities view inefficient incompetent lazy emotional displays displays weakness easy enemies approach remember absolutely depend having functioning team achieve goals validation feedback curiously sensitive true powerhouses cultivate image larger life remember stature comes actions actions team props important recognize contributions talents needs especially emotional perspective support network adopt fake til mentality able combine emotionally healthy focus alongside strengths rewarded deep satisfying relationships challenging victories handle member create free profile taking test entering results member create free profile taking test entering results armed powerful intellect strategic thinking overcome outmaneuver obstacles unbeatable time quirks unconstrained rationalism lead misunderstandings misunderstandings end read far introduction great deal tell point reading results probably hit tipping point went trademark skepticism huh wait little uncomfortable understood closest chances accepted maybe grown proud embracing disconnection requirement misused defense mechanism leading lonely inefficient path gaining insight rewarding date birth gimmick spy spent years studying life stories experiences patterns hundreds surveys step step insight insight discovered share qualities outlook overcome challenges faced unique individual wise learn experiences like share insights forward e books interactive courses offer deeper mind answer act way find motivation inspiration moved fear pursue secretly want achieve life use strengths unlock exceptional potential avoid common pitfalls staying true point grow person know capable ways finally feel right read member create free profile taking test entering results
entp,person extraverted intuitive thinking prospecting traits tend bold creative deconstructing rebuilding ideas great mental agility pursue goals vigorously despite resistance encounter loves process mental sparring gives chance exercise effortlessly quick wit broad accumulated knowledge base capacity connecting disparate ideas prove points ultimate devil thriving process shredding arguments beliefs letting ribbons drift wind trying achieve deeper purpose strategic goal simple reason fun playing devil helps develop better sense reasoning better understanding opposing ideas ones arguing tactic confused sort mutual understanding diplomat seek like analyst constant quest knowledge better way gain attack defend idea angle follow path unsafe independent thinker expose ideas dangers controversy speak mind fear label crack pot stigma conformity issues important stand counted cost taking certain pleasure underdog enjoy mental exercise found questioning prevailing mode thought making irreplaceable reworking existing systems shaking things pushing clever new directions miserable managing day day mechanics actually implementing suggestions love brainstorm think big avoid getting caught grunt work costs percent population right lets create original ideas step let numerous fastidious handle logistics implementation maintenance capacity debate vexing appreciated called fall painfully flat step toes openly questioning boss meeting picking apart significant says complicated unyielding honesty mince words cares little seen sensitive compassionate likeminded sensitive society general conflict averse preferring feelings comfort white lies unpleasant truths hard rationality frustrates find quarrelsome fun burns bridges oftentimes inadvertently plow thresholds having beliefs questioned feelings brushed aside treating treated little tolerance coddled dislike beat bush especially asking favor find respected vision confidence knowledge keen sense humor struggle utilize qualities basis deeper friendships romantic relationships longer road harnessing natural abilities intellectual independence free form vision tremendously valuable charge ear getting level follow struggle secured position remember ideas come fruition depend assemble pieces spent time winning arguments building consensus find simply support necessary successful playing devil find complex rewarding intellectual challenge understand sentimental perspective argue consideration compromise alongside logic progress member create free profile taking test entering results member create free profile taking test entering results armed powerful intellect vivid imagination overcome outmaneuver obstacles unbeatable time quirks unconstrained rationalism lead misunderstandings misunderstandings end read far introduction great deal tell point reading results probably hit tipping point went trademark skepticism huh wait little uncomfortable understood closest chances accepted maybe grown proud embracing disconnection requirement misused defense mechanism leading lonely inefficient path gaining insight rewarding date birth gimmick spy spent years studying life stories experiences patterns hundreds surveys step step insight insight discovered share qualities outlook overcome challenges faced unique individual wise learn experiences like share insights forward e books interactive courses offer deeper mind answer act way find motivation inspiration moved fear pursue secretly want achieve life use strengths unlock exceptional potential avoid common pitfalls staying true point grow person know capable ways finally feel right read member create free profile taking test entering results
infj,introverted intuitive feeling judging traits tend approach life deep thoughtfulness imagination inner vision personal values quiet principled version humanism guide things treat ought help capable rarest leave mark world deep sense idealism integrity idle dreamers concrete steps realize goals lasting impact unique combination traits makes complex versatile example speak great passion conviction especially standing ideals times choose soft spoken understated preferring peace challenge generally strive right want help create world right thing feel called use strengths including creativity imagination sensitivity uplift spread compassion concepts like egalitarianism karma mean great deal helping purpose life troubled injustice typically care altruism personal gain result tend step facing unfairness hardship aspire fix society deeper problems hope unfairness hardship things past reserved communicate way warm sensitive emotional honesty insight powerful impression value deep authentic relationships tend great care feelings said prioritize reconnecting time decompress recharge process thoughts feelings times focus intently ideals care feel allowed rest achieved unique vision success mindset lead stress burnout happens find feeling uncharacteristically ill tempered find feeling especially stressed face conflict criticism tend act best intentions frustrate appreciate times constructive criticism feel deeply personal hurtful feel compelled find mission lives encounter inequity unfairness tend think fix suited support movement right wrong matter big small remember busy taking care world care member create free profile taking test entering results member create free profile taking test entering results end actions respond circumstance reveals character passionate enigmatic infjs stand imagination compassion integrity deeply held principles unlike idealistic capable turning ideals plans executing face challenges idealistic dedicated frustrated comes navigating interpersonal conflicts confronting unpleasant facts pursuing realization finding fulfilling career path result find questioning meant read far introduction represents percent tell muttered wow accurate creepy know closest little uncomfortable deeply understood trick felt understood spent years studying life stories experiences responses hundreds surveys step step insight insight discovered exactly think reach potential know challenges faced face future overcome simply learn mistakes successes order road map fits needs life short stumble grasping scattered contradictory advice work   population deeper mind answer ready learn act way face fears goals secretly dream unlock true exceptional potential staying true premium profile provides road map focused confident successful willing challenge face fears ask answer questions asked quick fix solution easy shortcut goal help grow person meant simply comfortable mask ready begin journey continue section waiting member create free profile taking test entering results
infp,possesses introverted intuitive feeling prospecting traits rare tend quiet open minded imaginative apply caring creative approach quiet unassuming infps vibrant passionate inner lives creative imaginative happily lose daydreams inventing sorts stories conversations minds known sensitivity profound emotional responses music art nature idealistic empathetic long deep soulful relationships feel called help makes small portion population feel lonely invisible adrift world appreciate traits unique gold glitter wander lost old strong wither deep roots reached frost share sincere curiosity depths human nature introspective core exquisitely attuned thoughts feelings yearn understand compassionate nonjudgmental willing hear person story opens turns comfort feel honored listen help empathy greatest gifts times liability troubles world weigh heavily shoulders vulnerable internalizing negative moods mindsets learn set boundaries feel overwhelmed wrongs set right things uneasy pretending sensitivity commitment authenticity tend crave opportunities creative expression comes surprise famous poets writers actors artists help muse meaning purpose life dreaming sorts stories ideas possibilities way imaginative landscapes explore inner nature place world beautiful trait tendency daydream fantasize action avoid feeling frustrated unfulfilled incapable sure steps turn dreams ideas reality tend feel directionless stuck connect sense purpose lives purpose uplifting ability feel suffering want help focus energy efforts end exhausted fortunately like flowers spring creativity idealism bloom darkest seasons know world perfect care making better quiet belief right thing explain inspire compassion kindness beauty member create free profile taking test entering results member create free profile taking test entering results poetic kindhearted infps unique gifts overcome sorts challenges obstacles brighten lives process tripped areas idealism altruism liability asset comes finding keeping partner making friends pursuing meaningful career planning future consciously develop weaker traits gain new skills draw strengths read far introduction complexity muttered wow accurate little creepy finally understands asked know closest trick felt understood studied think reach potential process learned overcome greatest personal challenges overcome challenges plan personal road map vision want head introduction learned tend behave certain circumstances key strengths weaknesses learned basics step discovery journey premium profile filled specific guidance advice area life career relationships premium profile empower understand means means ready create path life section member create free profile taking test entering results
enfj,person extraverted intuitive feeling judging traits warm forthright love helping tend strong ideas values perspective creative energy achieve goals right ripples outward affects posture shine heart transmit anxiety breath radiate love muddy room depression glance awaken joy words inspire freedom act open hearts minds natural born leaders passion charisma forming percent population oftentimes politicians coaches teachers reaching inspiring achieve good world natural confidence begets influence great deal pride joy guiding work improve community drawn strong radiate authenticity concern altruism unafraid stand speak feel needs said find natural easy communicate especially person intuitive n trait helps reach mind facts logic raw emotion easily motivations seemingly disconnected events able bring ideas communicate common goal eloquence short mesmerizing interest genuine fault believe involved person problems place trust luckily trust tends fulfilling prophecy altruism authenticity inspire care better careful overextend optimism pushing ready willing vulnerable snare tremendous capacity reflecting analyzing feelings caught person plight develop sort emotional hypochondria seeing problems trying fix wrong point held limitations experiencing hinder ability past dilemma help happens important pull use reflection distinguish feel separate issue needs looked perspective passionate altruists fault unlikely afraid slings arrows standing ideas believe wonder famous cultural political icons wants lead way brighter future leading nation prosperity leading little league softball team hard fought victory member create free profile taking test entering results member create free profile taking test entering results inspiring charismatic idealism vision allow overcome challenging obstacles brightening lives imagination invaluable areas including personal growth easily tripped areas idealism altruism liability asset finding keeping partner staying calm pressure reaching dazzling heights career ladder making difficult decisions conscious effort develop weaker traits additional skills read far introduction complex concept muttered wow accurate little creepy finally understands asked know closest trick felt understood studied think reach potential spy challenges faced face future overcome simply learn succeeded order plan personal roadmap best car world right place know want told tend behave certain circumstances key strengths weaknesses deeper answer knowledge beginning lifelong journey ready learn act way motivates inspires afraid secretly dream unlock true exceptional potential premium profiles provide roadmap happier successful versatile willing able challenge obvious imagine follow path instead going flow want reins hands help member create free profile taking test entering results
enfp,extraverted intuitive feeling prospecting traits tend embrace big ideas actions reflect sense hope goodwill vibrant energy flow directions interest living want know ache dare dream meeting heart longing interest old want know risk looking like fool love dreams adventure alive true free spirit life party unlike explorer role group interested sheer excitement pleasure moment enjoying social emotional connections charming independent energetic compassionate   population comprise certainly felt crowd sociable pleasers like diplomat cousins shaped intuitive n quality allowing read lines curiosity energy tend life big complex puzzle connected unlike analyst tend puzzle series systemic machinations prism emotion compassion mysticism looking deeper meaning likely find qualities irresistible found cause sparks imagination bring energy oftentimes thrusts spotlight held peers leader guru independence loving want worse find beset administrative tasks routine maintenance accompany leadership position esteem dependent ability come original solutions know freedom innovative quickly lose patience dejected trapped boring role luckily know relax perfectly capable switching passionate driven idealist workplace imaginative enthusiastic free spirit dance floor suddenness surprise closest friends mix gives chance connect emotionally giving cherished insight motivates friends colleagues believe time recognize express feelings empathy sociability natural conversation topic needs careful rely intuition assume anticipate friend motivations misread signals frustrate plans straightforward approach simple kind social stress bugbear keeps harmony focused diplomats awake night emotional sensitive step toes feel spend lot time exploring social relationships feelings ideas find rings true finally find place world imagination empathy courage likely produce incredible results member create free profile taking test entering results member create free profile taking test entering results creative charismatic known idealism enthusiasm good dealing unexpected challenges brightening lives imagination invaluable areas including personal growth easily tripped areas idealism kindness liability asset finding keeping partner staying calm pressure reaching dazzling heights career ladder making difficult decisions conscious effort develop weaker traits additional skills read far introduction complex concept muttered wow accurate little creepy finally understands asked know closest trick felt understood studied think reach potential spy challenges faced face future overcome simply learn succeeded order plan personal roadmap best car world right place know want told tend behave certain circumstances key strengths weaknesses deeper answer knowledge beginning lifelong journey ready learn act way motivates inspires afraid secretly dream unlock true exceptional potential premium profiles provide roadmap happier successful versatile willing able challenge obvious imagine follow path instead going flow want reins hands help member create free profile taking test entering results
